{
  "schema_version": 1,
  "content_version": 1,
  "id": "u0-finals-1",
  "unit": 0,
  "title_ms": "Akhiran asas: a, o, e",
  "duration_seconds": 120,
  "items": [
    {
      "kind": "pronunciation",
      "id": "u0-finals-1-1",
      "focus": "finals",
      "hanzi": "八",
      "pinyin": "bā",
      "explanation_ms": "Dengar dahulu, ulang audio perlahan, kemudian cuba sebut. Akhiran a: buka mulut dengan selesa. Dengarkan a dalam bā.",
      "tones": [
        1
      ],
      "tone_note_ms": "Tanda nada pada pinyin ialah nada kamus. Fokus pada bunyi ini dahulu; jangan meneka bunyi melalui ejaan Melayu.",
      "source": "Standard Mandarin Hanyu Pinyin teaching notes; pronunciation and generated audio require teacher listening review before pronunciation assessment.",
      "needs_review": false,
      "audio": {
        "text": "八",
        "lang": "zh-CN",
        "slow_rate": 0.7,
        "needs_audio_review": true
      }
    },
    {
      "kind": "pronunciation",
      "id": "u0-finals-1-2",
      "focus": "finals",
      "hanzi": "波",
      "pinyin": "bō",
      "explanation_ms": "Dengar dahulu, ulang audio perlahan, kemudian cuba sebut. Akhiran o: bibir membulat. Dengarkan o selepas b dalam bō.",
      "tones": [
        1
      ],
      "tone_note_ms": "Tanda nada pada pinyin ialah nada kamus. Fokus pada bunyi ini dahulu; jangan meneka bunyi melalui ejaan Melayu.",
      "source": "Standard Mandarin Hanyu Pinyin teaching notes; pronunciation and generated audio require teacher listening review before pronunciation assessment.",
      "needs_review": false,
      "audio": {
        "text": "波",
        "lang": "zh-CN",
        "slow_rate": 0.7,
        "needs_audio_review": true
      }
    },
    {
      "kind": "pronunciation",
      "id": "u0-finals-1-3",
      "focus": "finals",
      "hanzi": "哥",
      "pinyin": "gē",
      "explanation_ms": "Dengar dahulu, ulang audio perlahan, kemudian cuba sebut. Akhiran e: lidah di belakang dan bibir tidak membulat. Bunyi ini tidak sama dengan e dalam semua perkataan Melayu.",
      "tones": [
        1
      ],
      "tone_note_ms": "Tanda nada pada pinyin ialah nada kamus. Fokus pada bunyi ini dahulu; jangan meneka bunyi melalui ejaan Melayu.",
      "source": "Standard Mandarin Hanyu Pinyin teaching notes; pronunciation and generated audio require teacher listening review before pronunciation assessment.",
      "needs_review": false,
      "audio": {
        "text": "哥",
        "lang": "zh-CN",
        "slow_rate": 0.7,
        "needs_audio_review": true
      }
    }
  ]
}
