{
  "schema_version": 1,
  "content_version": 1,
  "id": "u0-finals-7",
  "unit": 0,
  "title_ms": "Bezakan akhiran berdekatan",
  "duration_seconds": 150,
  "items": [
    {
      "kind": "pronunciation",
      "id": "u0-finals-7-1",
      "focus": "finals",
      "hanzi": "先，元",
      "pinyin": "xiān, yuán",
      "explanation_ms": "Dengar dahulu, ulang audio perlahan, kemudian cuba sebut. Ian dan üan: bandingkan xiān dengan yuán. Untuk üan bibir bermula bulat; ejaan yuan menggugurkan titik ü.",
      "tones": [
        1,
        2
      ],
      "tone_note_ms": "Tanda nada pada pinyin ialah nada kamus. Fokus pada bunyi ini dahulu; jangan meneka bunyi melalui ejaan Melayu.",
      "source": "Standard Mandarin Hanyu Pinyin teaching notes; pronunciation and generated audio require teacher listening review before pronunciation assessment.",
      "needs_review": false,
      "audio": {
        "text": "先，元",
        "lang": "zh-CN",
        "slow_rate": 0.7,
        "needs_audio_review": true
      }
    },
    {
      "kind": "pronunciation",
      "id": "u0-finals-7-2",
      "focus": "finals",
      "hanzi": "心，云",
      "pinyin": "xīn, yún",
      "explanation_ms": "Dengar dahulu, ulang audio perlahan, kemudian cuba sebut. In dan ün: bandingkan xīn dengan yún. Dalam yun, titik ü tidak ditulis tetapi bunyinya tetap ü.",
      "tones": [
        1,
        2
      ],
      "tone_note_ms": "Tanda nada pada pinyin ialah nada kamus. Fokus pada bunyi ini dahulu; jangan meneka bunyi melalui ejaan Melayu.",
      "source": "Standard Mandarin Hanyu Pinyin teaching notes; pronunciation and generated audio require teacher listening review before pronunciation assessment.",
      "needs_review": false,
      "audio": {
        "text": "心，云",
        "lang": "zh-CN",
        "slow_rate": 0.7,
        "needs_audio_review": true
      }
    },
    {
      "kind": "pronunciation",
      "id": "u0-finals-7-3",
      "focus": "finals",
      "hanzi": "香，光",
      "pinyin": "xiāng, guāng",
      "explanation_ms": "Dengar dahulu, ulang audio perlahan, kemudian cuba sebut. Iang dan uang: bandingkan permulaan i dalam xiāng dengan u yang membulat dalam guāng. Kedua-duanya berakhir ng.",
      "tones": [
        1,
        1
      ],
      "tone_note_ms": "Tanda nada pada pinyin ialah nada kamus. Fokus pada bunyi ini dahulu; jangan meneka bunyi melalui ejaan Melayu.",
      "source": "Standard Mandarin Hanyu Pinyin teaching notes; pronunciation and generated audio require teacher listening review before pronunciation assessment.",
      "needs_review": false,
      "audio": {
        "text": "香，光",
        "lang": "zh-CN",
        "slow_rate": 0.7,
        "needs_audio_review": true
      }
    },
    {
      "kind": "pronunciation",
      "id": "u0-finals-7-4",
      "focus": "finals",
      "hanzi": "星，胸",
      "pinyin": "xīng, xiōng",
      "explanation_ms": "Dengar dahulu, ulang audio perlahan, kemudian cuba sebut. Ing dan iong: dengarkan xīng dan xiōng; bibir lebih membulat pada iong. Kedua-duanya berakhir ng.",
      "tones": [
        1,
        1
      ],
      "tone_note_ms": "Tanda nada pada pinyin ialah nada kamus. Fokus pada bunyi ini dahulu; jangan meneka bunyi melalui ejaan Melayu.",
      "source": "Standard Mandarin Hanyu Pinyin teaching notes; pronunciation and generated audio require teacher listening review before pronunciation assessment.",
      "needs_review": false,
      "audio": {
        "text": "星，胸",
        "lang": "zh-CN",
        "slow_rate": 0.7,
        "needs_audio_review": true
      }
    },
    {
      "kind": "pronunciation",
      "id": "u0-finals-7-5",
      "focus": "finals",
      "hanzi": "轮，翁",
      "pinyin": "lún, wēng",
      "explanation_ms": "Dengar dahulu, ulang audio perlahan, kemudian cuba sebut. Uen ditulis un selepas awalan: lún berakhir n. Ueng muncul sebagai weng tanpa awalan: wēng berakhir ng. Bandingkan dengan teliti.",
      "tones": [
        2,
        1
      ],
      "tone_note_ms": "Tanda nada pada pinyin ialah nada kamus. Fokus pada bunyi ini dahulu; jangan meneka bunyi melalui ejaan Melayu.",
      "source": "Standard Mandarin Hanyu Pinyin teaching notes; pronunciation and generated audio require teacher listening review before pronunciation assessment.",
      "needs_review": false,
      "audio": {
        "text": "轮，翁",
        "lang": "zh-CN",
        "slow_rate": 0.7,
        "needs_audio_review": true
      }
    }
  ]
}
