{
  "schema_version": 1,
  "content_version": 1,
  "id": "u0-initials-1",
  "unit": 0,
  "title_ms": "Awalan 1: b, p, m",
  "duration_seconds": 100,
  "items": [
    {
      "kind": "pronunciation",
      "id": "u0-initials-1-1",
      "focus": "initials",
      "hanzi": "八",
      "pinyin": "bā",
      "explanation_ms": "Dengar dahulu, ulang audio perlahan, kemudian cuba sebut. Awalan b: Bibir dirapatkan lalu dibuka untuk b. Hembusan lebih sedikit daripada p; jangan tambah vokal selepas huruf b.",
      "tones": [
        1
      ],
      "tone_note_ms": "Tanda nada pada pinyin ialah nada kamus. Fokus pada bunyi ini dahulu; jangan meneka bunyi melalui ejaan Melayu.",
      "source": "Standard Mandarin Hanyu Pinyin teaching notes; pronunciation and generated audio require teacher listening review before pronunciation assessment.",
      "needs_review": false,
      "audio": {
        "text": "八",
        "lang": "zh-CN",
        "slow_rate": 0.7,
        "needs_audio_review": true
      }
    },
    {
      "kind": "pronunciation",
      "id": "u0-initials-1-2",
      "focus": "initials",
      "hanzi": "怕",
      "pinyin": "pà",
      "explanation_ms": "Dengar dahulu, ulang audio perlahan, kemudian cuba sebut. Awalan p: Bibir dirapatkan lalu dibuka dengan hembusan jelas untuk p. Bandingkan dengan b dalam bā.",
      "tones": [
        4
      ],
      "tone_note_ms": "Tanda nada pada pinyin ialah nada kamus. Fokus pada bunyi ini dahulu; jangan meneka bunyi melalui ejaan Melayu.",
      "source": "Standard Mandarin Hanyu Pinyin teaching notes; pronunciation and generated audio require teacher listening review before pronunciation assessment.",
      "needs_review": false,
      "audio": {
        "text": "怕",
        "lang": "zh-CN",
        "slow_rate": 0.7,
        "needs_audio_review": true
      }
    },
    {
      "kind": "pronunciation",
      "id": "u0-initials-1-3",
      "focus": "initials",
      "hanzi": "妈",
      "pinyin": "mā",
      "explanation_ms": "Dengar dahulu, ulang audio perlahan, kemudian cuba sebut. Awalan m: Untuk m, bibir rapat dan suara melalui hidung; buka kepada a.",
      "tones": [
        1
      ],
      "tone_note_ms": "Tanda nada pada pinyin ialah nada kamus. Fokus pada bunyi ini dahulu; jangan meneka bunyi melalui ejaan Melayu.",
      "source": "Standard Mandarin Hanyu Pinyin teaching notes; pronunciation and generated audio require teacher listening review before pronunciation assessment.",
      "needs_review": false,
      "audio": {
        "text": "妈",
        "lang": "zh-CN",
        "slow_rate": 0.7,
        "needs_audio_review": true
      }
    }
  ]
}
